"Pattern","Best Partitioning Strategies","Rationale"
"Map","SDP, SIP, Horizontal","Independent operations with no communication between tasks"
"Pipeline","TDP, TIP","Sequential stages with data flowing between them"
"Stencil","SDP, Horizontal","Neighbor-dependent operations on spatial data"
"Master-Worker","SIP, Horizontal, Hash","Centralized task distribution with independent worker tasks"
"Reduction","SDP, SIP","Converging operations that can be done in a tree-like fashion"
"Fork-Join","SIP, Horizontal","Independent tasks with synchronization points"
"Divide & Conquer","SIP, Horizontal","Recursive division of work with hierarchical combination"
"Scatter-Gather","SDP, Horizontal, Hash","Distribution followed by collection of results"